{
  "schema_version": "0.1.0",
  "scope_version": "0.1.1",
  "thinker_id": "TH.PLATO",
  "scope_basis": "PELUCCHI_2025_SOURCE_EXPLICIT_37",
  "scope_status": "SOURCE_COMPLETE_IDENTITY_REVIEW_ACTIVE",
  "source_refs": [
    "Marco Pelucchi, Gli epigrammi attribuiti a Platone: problemi ecdotici di un corpus pseudepigrafo, Atene e Roma 19 (2025), 140-157, DOI 10.7347/AR-2025-p140",
    "Marco Pelucchi, Gli epigrammi di Platone. Studio introduttivo, edizione e commento, Milano University Press (2026), DOI 10.54103/consonanze.269"
  ],
  "items": [
    {
      "scope_id": "TH.PLATO.EPSCOPE.AP_5_78",
      "logical_reference": "AP 5.78",
      "witnesses": [
        {
          "scheme": "AP",
          "reference": "5.78",
          "relation": "PRIMARY"
        }
      ],
      "attribution_targets": [
        "PLATO_PHILOSOPHER",
        "ANONYMOUS"
      ],
      "profile_relation": "MIXED_REVIEW",
      "current_catalog_id": "TH.PLATO.CAT.EPIGRAM_5_78",
      "catalog_mapping_status": "PRESENT",
      "pelucchi_2026_number": null,
      "source_anchors": [
        "PELUCCHI_2025_P142",
        "PELUCCHI_2025_P144"
      ],
      "notes": "Agathon epigram; anonymous transmission also attested."
    },
    {
      "scope_id": "TH.PLATO.EPSCOPE.AP_5_79",
      "logical_reference": "AP 5.79",
      "witnesses": [
        {
          "scheme": "AP",
          "reference": "5.79",
          "relation": "PRIMARY"
        }
      ],
      "attribution_targets": [
        "PLATO_PHILOSOPHER"
      ],
      "profile_relation": "PHILOSOPHER_CANDIDATE",
      "current_catalog_id": "TH.PLATO.CAT.EPIGRAM_5_79",
      "catalog_mapping_status": "PRESENT",
      "pelucchi_2026_number": 7,
      "source_anchors": [
        "PELUCCHI_2025_P153"
      ],
      "notes": "Pelucchi discusses assignment to Plato and labels it FGE 4 = epigr. 7 PELUCCHI."
    },
    {
      "scope_id": "TH.PLATO.EPSCOPE.AP_5_80",
      "logical_reference": "AP 5.80",
      "witnesses": [
        {
          "scheme": "AP",
          "reference": "5.80",
          "relation": "PRIMARY"
        }
      ],
      "attribution_targets": [
        "PLATO_PHILOSOPHER",
        "OTHER_AUTHOR"
      ],
      "profile_relation": "MIXED_REVIEW",
      "current_catalog_id": "TH.PLATO.CAT.EPIGRAM_5_80",
      "catalog_mapping_status": "PRESENT",
      "pelucchi_2026_number": 8,
      "source_anchors": [
        "PELUCCHI_2025_P142",
        "PELUCCHI_2025_P144"
      ],
      "notes": "Competing Philodemus attribution."
    },
    {
      "scope_id": "TH.PLATO.EPSCOPE.AP_7_99",
      "logical_reference": "AP 7.99",
      "witnesses": [
        {
          "scheme": "AP",
          "reference": "7.99",
          "relation": "PRIMARY"
        }
      ],
      "attribution_targets": [
        "PLATO_PHILOSOPHER"
      ],
      "profile_relation": "PHILOSOPHER_CANDIDATE",
      "current_catalog_id": "TH.PLATO.CAT.EPIGRAM_7_99",
      "catalog_mapping_status": "PRESENT",
      "pelucchi_2026_number": 3,
      "source_anchors": [
        "PELUCCHI_2025_P142"
      ],
      "notes": null
    },
    {
      "scope_id": "TH.PLATO.EPSCOPE.AP_7_100",
      "logical_reference": "AP 7.100",
      "witnesses": [
        {
          "scheme": "AP",
          "reference": "7.100",
          "relation": "PRIMARY"
        }
      ],
      "attribution_targets": [
        "PLATO_PHILOSOPHER"
      ],
      "profile_relation": "PHILOSOPHER_CANDIDATE",
      "current_catalog_id": "TH.PLATO.CAT.EPIGRAM_7_100",
      "catalog_mapping_status": "PRESENT",
      "pelucchi_2026_number": 4,
      "source_anchors": [
        "PELUCCHI_2025_P142"
      ],
      "notes": null
    },
    {
      "scope_id": "TH.PLATO.EPSCOPE.ARCHEANASSA",
      "logical_reference": "Archeanassa Platonic tradition",
      "witnesses": [
        {
          "scheme": "AP",
          "reference": "7.217",
          "relation": "RELATED"
        },
        {
          "scheme": "DIOGENES_LAERTIUS",
          "reference": "3.31",
          "relation": "PARALLEL"
        },
        {
          "scheme": "ATHENAEUS",
          "reference": "12.589c",
          "relation": "PARALLEL"
        }
      ],
      "attribution_targets": [
        "PLATO_PHILOSOPHER",
        "OTHER_AUTHOR"
      ],
      "profile_relation": "MIXED_REVIEW",
      "current_catalog_id": "TH.PLATO.CAT.EPIGRAM_ARCHEANASSA",
      "catalog_mapping_status": "PRESENT",
      "pelucchi_2026_number": 5,
      "source_anchors": [
        "PELUCCHI_2025_P142"
      ],
      "notes": "Platonic version/tradition must remain distinct from naive identity with the Anthology witness."
    },
    {
      "scope_id": "TH.PLATO.EPSCOPE.AP_7_669",
      "logical_reference": "AP 7.669",
      "witnesses": [
        {
          "scheme": "AP",
          "reference": "7.669",
          "relation": "PRIMARY"
        }
      ],
      "attribution_targets": [
        "PLATO_PHILOSOPHER"
      ],
      "profile_relation": "PHILOSOPHER_CANDIDATE",
      "current_catalog_id": "TH.PLATO.CAT.EPIGRAM_7_669",
      "catalog_mapping_status": "PRESENT",
      "pelucchi_2026_number": 1,
      "source_anchors": [
        "PELUCCHI_2025_P142"
      ],
      "notes": null
    },
    {
      "scope_id": "TH.PLATO.EPSCOPE.AP_7_670",
      "logical_reference": "AP 7.670",
      "witnesses": [
        {
          "scheme": "AP",
          "reference": "7.670",
          "relation": "PRIMARY"
        }
      ],
      "attribution_targets": [
        "PLATO_PHILOSOPHER"
      ],
      "profile_relation": "PHILOSOPHER_CANDIDATE",
      "current_catalog_id": "TH.PLATO.CAT.EPIGRAM_7_670",
      "catalog_mapping_status": "PRESENT",
      "pelucchi_2026_number": 2,
      "source_anchors": [
        "PELUCCHI_2025_P142"
      ],
      "notes": null
    },
    {
      "scope_id": "TH.PLATO.EPSCOPE.AP_7_256",
      "logical_reference": "AP 7.256",
      "witnesses": [
        {
          "scheme": "AP",
          "reference": "7.256",
          "relation": "PRIMARY"
        }
      ],
      "attribution_targets": [
        "PLATO_UNSPECIFIED",
        "ANONYMOUS"
      ],
      "profile_relation": "MIXED_REVIEW",
      "current_catalog_id": "TH.PLATO.CAT.EPIGRAM_7_256",
      "catalog_mapping_status": "PRESENT",
      "pelucchi_2026_number": 11,
      "source_anchors": [
        "PELUCCHI_2025_P142",
        "PELUCCHI_2025_P144"
      ],
      "notes": null
    },
    {
      "scope_id": "TH.PLATO.EPSCOPE.AP_7_259",
      "logical_reference": "AP 7.259",
      "witnesses": [
        {
          "scheme": "AP",
          "reference": "7.259",
          "relation": "PRIMARY"
        }
      ],
      "attribution_targets": [
        "PLATO_UNSPECIFIED"
      ],
      "profile_relation": "PHILOSOPHER_CANDIDATE",
      "current_catalog_id": "TH.PLATO.CAT.EPIGRAM_7_259",
      "catalog_mapping_status": "PRESENT",
      "pelucchi_2026_number": 10,
      "source_anchors": [
        "PELUCCHI_2025_P142"
      ],
      "notes": null
    },
    {
      "scope_id": "TH.PLATO.EPSCOPE.AP_7_265",
      "logical_reference": "AP 7.265",
      "witnesses": [
        {
          "scheme": "AP",
          "reference": "7.265",
          "relation": "PRIMARY"
        }
      ],
      "attribution_targets": [
        "PLATO_UNSPECIFIED"
      ],
      "profile_relation": "PHILOSOPHER_CANDIDATE",
      "current_catalog_id": "TH.PLATO.CAT.EPIGRAM_7_265",
      "catalog_mapping_status": "PRESENT",
      "pelucchi_2026_number": null,
      "source_anchors": [
        "PELUCCHI_2025_P142"
      ],
      "notes": null
    },
    {
      "scope_id": "TH.PLATO.EPSCOPE.AP_7_268",
      "logical_reference": "AP 7.268",
      "witnesses": [
        {
          "scheme": "AP",
          "reference": "7.268",
          "relation": "PRIMARY"
        }
      ],
      "attribution_targets": [
        "PLATO_UNSPECIFIED"
      ],
      "profile_relation": "PHILOSOPHER_CANDIDATE",
      "current_catalog_id": "TH.PLATO.CAT.EPIGRAM_7_268",
      "catalog_mapping_status": "PRESENT",
      "pelucchi_2026_number": null,
      "source_anchors": [
        "PELUCCHI_2025_P142"
      ],
      "notes": "Correct Page/FGE XVIII mapping; not AP 7.368."
    },
    {
      "scope_id": "TH.PLATO.EPSCOPE.AP_7_269",
      "logical_reference": "AP 7.269",
      "witnesses": [
        {
          "scheme": "AP",
          "reference": "7.269",
          "relation": "PRIMARY"
        }
      ],
      "attribution_targets": [
        "PLATO_UNSPECIFIED"
      ],
      "profile_relation": "PHILOSOPHER_CANDIDATE",
      "current_catalog_id": "TH.PLATO.CAT.EPIGRAM_7_269",
      "catalog_mapping_status": "PRESENT",
      "pelucchi_2026_number": null,
      "source_anchors": [
        "PELUCCHI_2025_P142"
      ],
      "notes": null
    },
    {
      "scope_id": "TH.PLATO.EPSCOPE.AP_6_1",
      "logical_reference": "AP 6.1",
      "witnesses": [
        {
          "scheme": "AP",
          "reference": "6.1",
          "relation": "PRIMARY"
        }
      ],
      "attribution_targets": [
        "PLATO_UNSPECIFIED"
      ],
      "profile_relation": "PHILOSOPHER_CANDIDATE",
      "current_catalog_id": "TH.PLATO.CAT.EPIGRAM_6_1",
      "catalog_mapping_status": "PRESENT",
      "pelucchi_2026_number": null,
      "source_anchors": [
        "PELUCCHI_2025_P142"
      ],
      "notes": null
    },
    {
      "scope_id": "TH.PLATO.EPSCOPE.AP_6_43",
      "logical_reference": "AP 6.43",
      "witnesses": [
        {
          "scheme": "AP",
          "reference": "6.43",
          "relation": "PRIMARY"
        }
      ],
      "attribution_targets": [
        "PLATO_UNSPECIFIED"
      ],
      "profile_relation": "PHILOSOPHER_CANDIDATE",
      "current_catalog_id": "TH.PLATO.CAT.EPIGRAM_6_43",
      "catalog_mapping_status": "PRESENT",
      "pelucchi_2026_number": null,
      "source_anchors": [
        "PELUCCHI_2025_P142"
      ],
      "notes": null
    },
    {
      "scope_id": "TH.PLATO.EPSCOPE.COUGNY_III_33",